{
  "schema_version": "1.0.0",
  "entities": [
    {
      "entity_id": "vault:1:0x1111111111111111111111111111111111111111",
      "entity_type": "vault",
      "chain_id": 1,
      "address_or_key": "0x1111111111111111111111111111111111111111",
      "label": "Fixture Catalog Vault",
      "source": "fixture:morpho",
      "catalog": true,
      "visible": true,
      "metadata": {
        "curator": "fixture-curator"
      }
    },
    {
      "entity_id": "vault:1:0x2222222222222222222222222222222222222222",
      "entity_type": "vault",
      "chain_id": 1,
      "address_or_key": "0x2222222222222222222222222222222222222222",
      "label": "Fixture Visible Neighbor",
      "source": "fixture:morpho",
      "catalog": false,
      "visible": true,
      "metadata": {
        "curator": "fixture-curator"
      }
    }
  ],
  "relationships": [
    {
      "source_entity_id": "vault:1:0x1111111111111111111111111111111111111111",
      "target_entity_id": "vault:1:0x2222222222222222222222222222222222222222",
      "relationship_type": "similar_to",
      "weight": "0.72",
      "metadata": {}
    }
  ],
  "similarities": [
    {
      "catalog_entity_id": "vault:1:0x1111111111111111111111111111111111111111",
      "candidate_entity_id": "vault:1:0x2222222222222222222222222222222222222222",
      "score": "0.72",
      "components": {
        "shared_markets": "0.30",
        "asset_overlap": "0.15",
        "oracle_overlap": "0.10",
        "irm_match": "0.07",
        "lltv_proximity": "0.05",
        "same_chain": "0.03",
        "same_curator": "0.02"
      },
      "missing_dimensions": [],
      "model_version": "vault-similarity-v1",
      "stored": true,
      "normally_visible": true,
      "computed_at": "2026-10-10T12:00:00Z"
    }
  ],
  "active_incidents": [],
  "generated_at": "2026-10-10T12:00:00Z"
}
